path,sentence
common_voice_bn_31662679.mp3,গেমটি প্রস্তুত করেছে ইএ কানাডা এবং ইএ স্পোর্টসের লেভেলে অধীনে বিশ্বব্যাপী প্রকাশ করা হয়েছে।
common_voice_bn_31686606.mp3,তিনি অবশ্যই আমার বইয়ের তাকে নারায়ণের গল্পগুলির পাশে স্থান নেবেন।
common_voice_bn_31665444.mp3,বিভিন্ন প্রজাতির পাখি বিভিন্ন ভাবে সমস্যমকাবালা করে থাকে।
common_voice_bn_31525266.mp3,ক্রমবর্ধমান অর্থনৈতিক ও কৌশলগত সম্পর্ক সত্ত্বেও ভারত এবং পিআরসি থেকে উত্তরণের জন্য প্রচুর প্রতিবন্ধকতা রয়েছে।
common_voice_bn_31590686.mp3,তবে ভনগণ প্রবাহ পথ পরিবর্তনের জন্য এই নদী দুই দেশের সীমান্ত সমস্যা হিসেবে পরিবর্ণিত হয়েছিল বহু বছর।
common_voice_bn_31651379.mp3,ডানহাতি উদ্বোধানে ব্যাটসম্যান হিসেবে কয়েক কামিং খেলতেন।
common_voice_bn_31522836.mp3,তার সৃষ্ট চরিত্র সদাশিব মারাঠা বীর শিবাজীর অভিযানের সাথে সম্পৃক্ত।
common_voice_bn_31574316.mp3,আবু তাহের সরকার।
common_voice_bn_31535884.mp3,ভুয়া ইকবাল কর্মজীবনের শুরুতে ততকালীন দৈনিক পাকিস্তান পত্রিকায় কাজ করেন।
common_voice_bn_31666805.mp3,গ্রামীণ জনগোষ্যের উন্নয়নে তথা গ্রাম বাংলাকে শহরের অনুরুপ গঠনে য়কভূমিকা পালন করছে।
common_voice_bn_31585402.mp3,"এছাড়া সরকার এবং অন্যান্য প্রতিষ্ঠানকে তথ্য, উপদেশ এবং সেবা প্রদান করা।"
common_voice_bn_31644534.mp3,ফ্রান্সের কাছ থেকে স্বাধীনতা পাবার পর মেকং বদ্বীপ বৃহত নাম প্রজাতন্ত্রের অংশ ছিল।
common_voice_bn_31518982.mp3,ব্যবস্থাটি ক্যামেরার মধ্যকার ক্রিস্টাল কর্তৃক শোষিত গামা ফোটন ঘটনা সংগ্রহ করে বা গণনা করে।
common_voice_bn_31529173.mp3,সেই সাথে সে আরো জানায় যে এই গানটি তাদের পরবর্তী অ্যালবামে অন্তর্ভুক্ত করা হতে পারে।
common_voice_bn_31648244.mp3,তিনি চন্দ্র রাজ্যের ব্যাপক বিস্তৃত করেন।
common_voice_bn_31561933.mp3,এই উপন্যাসটি দেশ পত্রিকায় ধারাবাহিক ভাবে প্রকাশিত হয়েছিল দুই পর্বে।
common_voice_bn_31661701.mp3,"ফলে কৃষিক্ষেত্রে মিশ্র জলবায়ুর প্রভাব পড়ে, যাদের মধ্যে মধ্যসাগ্রীয় শুষ্ক গ্রীষ্ম, শীত, বর্ষা ইত্যাদি আবহাবিশেষভাবে উল্লেখ্য যোগ্য।"
common_voice_bn_31627474.mp3,পরবর্তীতে ভিক্টোরিয়া ক্রিকেট সংস্থায় সহসভাপতি মনোনীত হন।
common_voice_bn_30998315.mp3,"পুরকৌশল বিদ্যা একটি সম্পর্কিত ক্ষেত্র, যা প্রকল্পগুলির ব্যবহারিক দ্বীপগুলির সাথে কাজ করে থাকে।"
common_voice_bn_31602596.mp3,আরব জাতীয়তাবাদের অন্যতম প্রাথমিক লক্ষ্য হল আরব বিশ্ব থেকে পশ্চিমা আধিপত্য দরিপিদ্ধ করা।
common_voice_bn_31528527.mp3,অন্যান্য ফার্সি পুথির মতো এটিও কাগজে লেখা।
common_voice_bn_31626498.mp3,এটি যুব ও ক্রীড়া মন্ত্রণালয়ের অধীনস্থ।
common_voice_bn_31588874.mp3,কিন্তু তিনি সব শুনেছেন এবং নিজেকে বিরক্ত বা বিচলিত না করার চেষ্টা করেছেন।
common_voice_bn_31625270.mp3,মেজর খালেদ এ অপারেশনে নেতৃত্ব দেন।
common_voice_bn_31580250.mp3,এ জমিতে ধান ও তুলা উৎপাদিত হবে।
common_voice_bn_31599660.mp3,ফরাসি ব্যাকারণের সাথে অন্যান্য রোমান্স ভাষার ব্যাকারণের অনেক ক্ষেত্রে মিল আছে।
common_voice_bn_31509058.mp3,তিনি উক্ত হামলার নিন্দা করেন।
common_voice_bn_31669745.mp3,অণুতে অনবিকষ্পতঐককষ পদে অবস্থানরত ইলেকট্রনের খুঁজে পাওয়ার সম্ভাব্য জায়গা গুলো উপস্থাপন করে।
common_voice_bn_31558096.mp3,তাদের মধ্যে শেখ নাসির উদ্দিন মুহাম্মদ চির আগে দিল্লি এবং প্রখ্যাত সুফি গায়ক এবং দিল্লি সালতানাতের রাজ্যসভার কবি আমির ঘোষ।
common_voice_bn_31700267.mp3,সংগঠনটি সরগাত পত্রিকার সদর দফতর দ্বিবার্ষিক বৈঠক করে।
common_voice_bn_31516073.mp3,"রাজনৈতিক স্লোগান, বিশ্বের সকল শ্রমিক এক হও।"
common_voice_bn_31501685.mp3,সপ্তাহান্তে শিশুদের জন্য বিকেলে শো থাকে।
common_voice_bn_31546001.mp3,এরপর পরবর্তী ইংল্যান্ড সিরিজ পর্যন্ত স্বীয় স্থান ধরে রাখেন।
common_voice_bn_31713464.mp3,অনেক প্রতিষ্ঠান ও ব্যক্তি অভিনয় নিয়ন্ত্রণ আইনের প্রতিবাদ করেন।
common_voice_bn_31672874.mp3,অনেক মুক্তিযোদ্ধা সাদার জানতেন না।
common_voice_bn_31602749.mp3,ব্রিটিশ যুগে সেখানে তিনটি যৌনপল্লি ছিলো।
common_voice_bn_31522175.mp3,কোপেনহেগেন বিজনেস স্কুলের নেতিবিন্দ ডেনমার্কে প্রথম একটি উন্মুক্ত প্রবেশাধিকার ম্যান্ডেট গ্রহণ করতে ভোট দিয়েছিলেন।
common_voice_bn_31555371.mp3,চেঙ্গিস খান চত্বরে মঙ্গোলিয়ার বিভিন্ন নেতার মূর্তি আছে।
common_voice_bn_31542021.mp3,অন্যতম সাথে বিপ্লবী অনিল ভাদুড়ী মারাত্মকভাবে আহত হন ও মারা যান।
common_voice_bn_31609950.mp3,দলে তিনি মূলতঃ ডানহাতে মিডিয়াম ফাস্ট বোলিং করে থাকেন।
common_voice_bn_31629796.mp3,"কুরাইশরা এরপর তার প্রতি নজর রাখতে শুরু করে, যাতে মক্কা থেকে বেরিয়ে যেতে না পারে।"
common_voice_bn_31648116.mp3,প্রাচ্য এবং পশ্চাত্ব উভয়ের চিত্রাঙ্কনের ইতিহাসের একটি অংশ ধর্মীয় চিত্রকলা দ্বারা প্রভাবিত।
common_voice_bn_31661047.mp3,তবে কোন টেস্ট খেলার সুযোগ পাননি।
common_voice_bn_31620567.mp3,তার শখ ছবি আঁকা।
common_voice_bn_31596516.mp3,যেমন যুক্তরাজ্যের মানবাধিকার বিষয়ক সর্বদলীয় সংসদীয় গোষ্ঠী।
common_voice_bn_31533248.mp3,দ্বিতীয়বার দায়িত্ব পালনকালে কৃষি উপমন্ত্রী ছিলেন।
common_voice_bn_31631337.mp3,শহরটির অর্থনৈতিক গুরুত্ব তার ভৌগোলিক অবস্থান থেকে উদ্ভূত।
common_voice_bn_31654759.mp3,এর সদর দফতর ম্যানহাটার নিউ ইয়র্ক সিটিতে অবস্থিত।
common_voice_bn_31558936.mp3,"তিনি একই সাথে ইংরেজ, জার্মান এবং স্পেনীয় বংশোদ্ভূত।"
common_voice_bn_31536741.mp3,এছাড়াও বেশ কয়েক বছর ল্যাঙ্কাশায়ার লীগে খেলেছেন।
common_voice_bn_31523657.mp3,দক্ষিণ তাং ও রাজ্য দখল করার পূর্ব পর্যন্ত তারা প্রতিবেশী রাজ্যের সাথে যুদ্ধে বৃত্ত ছিল।
common_voice_bn_31582238.mp3,এটি সুলতানী আমলের স্থাপত্য কৌশল অবলম্বনে নির্মিত।
common_voice_bn_31557247.mp3,সরকার ও গণমাধ্যমের এই প্রক্রিয়ার পরে মার্কিন যুক্তরাষ্ট্রের কমিক বই প্রতিষ্ঠানসমূহ কমিক ম্যাগি অ্যাসোসিয়েশন আমেরিকা গড়ে তোলে।
common_voice_bn_31577727.mp3,এছাড়া তিনি খুলনা সাহিত্য পরিষদের অন্যতম প্রতিষ্ঠাতা ও সহসভাপতি ছিলেন।
common_voice_bn_31561831.mp3,মুক্তির পর এটি ভারতে সব ওপেনিং বক্স অফিস রেকর্ড ভঙ্গ করে।
common_voice_bn_31531506.mp3,এমন দশটি দল একজন মালিক এর অধীনে থাকত।
common_voice_bn_31015890.mp3,এতে কোনো মূল থাকে না।
common_voice_bn_31509427.mp3,বেশিরভাগ ক্ষেত্রেই সুরক্ষা চাইতে বা একটি সম্ভাব্য দুর্ভিক্ষ থেকে বাঁচতে তার কাছে অনুরোধ করা হয়েছে।
common_voice_bn_31584826.mp3,একটি ভবন দোতলা আর দুটি ভবন রয়েছে একতলা।
common_voice_bn_31500136.mp3,ঘন সবুজ ক্ষেতে ভরা এই গ্রামের অর্থনীতি মূলত কৃষিভিত্তিক।
common_voice_bn_31610609.mp3,কিন্তু গুজরাতের অর্থনৈতিক উন্নতির বিদ্ধিতেরসয়ক পরিবেশ ঘটনার জন্য তিনি তার আর্থিক নীতির জন্য প্রশংসিত হয়েছেন।
common_voice_bn_31676837.mp3,শহরটি ফ্রান্সের দক্ষিণ উপকূলে ভূমধ্যসাগরের তীরে অবস্থিত।
common_voice_bn_31574795.mp3,অতঃপর তিনি অবসর গ্রহণ করেন।
common_voice_bn_31668158.mp3,আলসেমিতে কাল থেকে পড়তে বসবো স্বভাব আমাদেরকে অনেকটাই পেছনে ফেলে দেয়।
common_voice_bn_31586537.mp3,মৃত্যুর আগ পর্যন্ত তারা সত্য প্রকাশ করে না।
common_voice_bn_31688693.mp3,"বিভিন্ন আন্তর্জাতিক সংস্থার সদর দফতর এখানে অবস্থিত, যাদের মধ্যে বিশ্ব পোস্টাল ইউনিয়নের নাম উল্লেখযোগ্য।"
common_voice_bn_31792312.mp3,এই দুটি ছবিতে অভিনয়ের জন্য তিনি শ্রেষ্ঠ অভিনেত্রী বিভাগে বাফটা পুরস্কার অর্জন করেন।
common_voice_bn_31039245.mp3,এই নদী বাংলাদেশ অভ্যন্তরীণ নৌপরিবহন কর্তৃপক্ষ কর্তৃক প্রথম শ্রেণির নৌপথ হিসেবে স্বীকৃত।
common_voice_bn_31572051.mp3,তারা মিশরের সর্ববৃহৎ খ্রিষ্টান সম্প্রদায় এবং এই অঞ্চলের সর্ববৃহৎ জাতিধর্মীয় সংখ্যালঘু সম্প্রদায়।
common_voice_bn_31616513.mp3,বর্তমানে তিনি বিভিন্ন সামাজিক সাংস্কৃতিক সংগঠনের সাথে যুক্ত।
common_voice_bn_31556127.mp3,প্রজাতিকে উল স্থির জলের আবাসে ছোট ছোট দলে জন্মায়।
common_voice_bn_31571034.mp3,যা গণনা এবং সংরক্ষণের কার্য থেকে আলাদাভাবে ব্যবহৃত হত।
common_voice_bn_31576212.mp3,তিনি তামিল নাড়ু অধিনায়ক এবং বিভিন্ন সময়ে উতৃক্ত অধিনায়ক হিসেবে ইন্ডিয়া এ দলের হয়ে নেতৃত্ব দিয়ে থাকেন।
common_voice_bn_31532479.mp3,কোক মার্কিন যুক্তরাষ্ট্রের নিউ ইয়র্ক শহরে বসবাস করেন।
common_voice_bn_31657577.mp3,এটি ছিল তখন পর্যন্ত বিমান নিয়ে পৌছনা সর্বাধিক উত্তর অক্ষাংশ।
common_voice_bn_31620621.mp3,তারপরে থাইল্যান্ড আর মালয় দলে দলে জাপানি সৈন্যরা ভির্ত শুরু করল।
common_voice_bn_31588388.mp3,কিন্তু তার কাতা চলচ্চিত্রে যোগদানের বিষয়ে বিরোধিতা করলে তারা গৃহত্যাগ করতে পারত হন।
common_voice_bn_31646763.mp3,সম্প্রতি বাণিজ্যিক কোম্পানিগুলো পণ্য পরিবহনের জন্য ড্রোন ব্যবহার করে অনুসন্ধান শুরু করেছে।
common_voice_bn_31627760.mp3,সাধারণত আফ্রিকায় পর্যটকের এই ধরনের ভ্রমণের অভিজ্ঞতা লাভ করেন।
common_voice_bn_31691607.mp3,মুদ্রণ যন্ত্রের কাজ বিষময় বিশেষভাবে তার শিক্ষা ও গবেষণার বিষয় হয়ে ওঠে।
common_voice_bn_31645313.mp3,প্রজনন মৌসুমে এই জোড়া পাখি আক্রমণাত্মক হয়ে থাকে।
common_voice_bn_31605830.mp3,এরপর দিল্লির শিক্ষা মন্ত্রণালয়ে যোগ দেন।
common_voice_bn_31693762.mp3,আমার ছেলে ঘড়ি দেখতে যানে।
common_voice_bn_31565546.mp3,এটাও আকর্ষণের কারণ।
common_voice_bn_31571782.mp3,এর ঠিক অপর পাশে রয়েছে ঈশ্বরগঞ্জ কলেজ।
common_voice_bn_31613629.mp3,পোর্টসমাউথ শহরটি নরফোক শহরের পশ্চিমে এরিজাবের নদীর পশ্চিম পাশে অবস্থিত।
common_voice_bn_31607444.mp3,নদীটি হচ্ছে ভৈরব নদী।
common_voice_bn_31599057.mp3,নতুন মৌসুমে তিনি আবার আসল রূপে ফিরে আসেন।
common_voice_bn_31002927.mp3,এর পূর্বে আরব সাগর এবং পচিমে পশ্চিম ঘাট পর্বতমালা।
common_voice_bn_31619578.mp3,এই কমিটিতে ছিলেন গোপাল হালদার ও মৈত্রেয়ী দেবী।
common_voice_bn_31531226.mp3,প্রত্যেক ফিফা সদস্য রাষ্ট্র থেকে তিনজন ভোটার থাকবেন একজন সাংবাদিক এবং জাতীয় পুরুষ দলের কোচ এবং অধিনায়ক।
common_voice_bn_31623417.mp3,পরে রবীন্দ্রনাথের স্নেহের পাত্রে পরিণত হন।
common_voice_bn_31639756.mp3,সুইজারল্যান্ডের ক্ষেত্রে একটি বিশেষ বিষয় লক্ষ্য করা গেছে।
common_voice_bn_31765147.mp3,ডানহাতে ব্যাটিংয়ের পাশাপাশি ডানহাতে ফাস্ট মিডিয়াম বোলিং করতেন মেরি ম্যাক্স ডাকনামে পরিচিত মাকসুদ আহমেদ।
common_voice_bn_31584508.mp3,"সূত্রের দাবি, উপসাগরীয় আরবরা নারীদের শোষণ করে।"
common_voice_bn_31543207.mp3,সাধারণ মানুষের সাথে দ্রুত মিশে যেতে পারার গুণ ছিল তার।
common_voice_bn_31635371.mp3,কিন্তু ব্যাট হাতে ব্যাপক সফলতা পান।
common_voice_bn_31625929.mp3,এশিয়া কাপের ইতিহাসে প্রতিযোগিতার প্রথম সেঞ্চুরি করার গৌরব অর্জন করেন তিনি।
common_voice_bn_31549847.mp3,তিনি প্রায়শই বাউন্স করতেন।
common_voice_bn_31522445.mp3,পশুর মধ্যে মহিষ এবং গরু উল্লেখযোগ্য।
common_voice_bn_31595250.mp3,লক্ষণগুলি বেশিরভাগ ক্ষেত্রেই অল্প থেকে মাঝারি হয়ে থাকে।
common_voice_bn_31534911.mp3,"এরপর অস্ট্রেলিয়া, ভারত ও নেদারল্যান্ডসের বিপক্ষে ওডিআইয়ে আয়ারল্যান্ডের প্রতিনিধিত্ব করেন।"
common_voice_bn_31665136.mp3,তিনি বিশ্রামে থাকা হাশিম আমলা স্থলাভিষিক্ত হন।
common_voice_bn_31530535.mp3,তিনি বাংলাদেশ শিশু একাডেমির পরিচালক হিসেবে দায়িত্ব পালন করেছেন।
common_voice_bn_31529736.mp3,এছাড়াও ডানহাতি মিডিয়াম ফাস্ট বোলিংয়ে পারদর্শী তিনি।
common_voice_bn_31627621.mp3,এই সকল চা বাগানে শ্রীমঙ্গলের জনসংখ্যার বিরাট একটা অংশ কাজ করছে।
common_voice_bn_31551635.mp3,বাংলাদেশ পালকের চার থিয়েটার হল মিলনায়তনে রাষ্ট্রপতি এই প্রধান প্রদান করেন।
common_voice_bn_31544269.mp3,"বহু বুদ্ধিজীবী, ব্রিটিশ উকিল ব্যবসায়ী এখানে বসবাস করা শুরু করেন।"
common_voice_bn_31552364.mp3,এই দলে এক কুকুর আছে।
common_voice_bn_31636708.mp3,এছাড়া তিনি সেরা নাট্য চলচ্চিত্র অভিনেত্রী বিভাগে গোল্ডেন গ্লোব পুরস্কার ও শ্রেষ্ঠ অভিনেত্রী বিভাগে বাফটা পুরস্কার অর্জন করেন।
common_voice_bn_31572269.mp3,কম্পিউটার বিজ্ঞানীদের অধীন বেশির ভাগ সমস্যা সমাধান মূলক অ্যালগরিদম কোনোনাকোনো ধরনের অনুসন্ধান অ্যালগোরিদম।
common_voice_bn_31523423.mp3,এটি বাঙালি মুসলমানদের ধর্মীয় কুসংস্কার বন্ধ করতে উৎসাহিত করেছিল।
common_voice_bn_31008732.mp3,পূর্বে অংশগ্রহণকারী দলের সংখ্যা ছিল আটটি।
common_voice_bn_31621245.mp3,প্রফুল্ল রায়ের আমন্ত্রণে তিনি মুম্বাই যান।
common_voice_bn_31564484.mp3,দুই পক্ষের এই বিরোধ পরিশেষে রূপ নেয় যুদ্ধে।
common_voice_bn_31542911.mp3,এরা কার্যকর জাতীয় পাখি।
common_voice_bn_31544383.mp3,তিনি স্থানীয়ভাবে মুক্তিযুদ্ধের পৃষ্ঠপোষক ছিলেন।
common_voice_bn_31550063.mp3,বিদ্যালয়টি কুমিল্লা শিক্ষা বোর্ডের অধীনে পরিচালিত।
common_voice_bn_31570299.mp3,এর উৎস ভারতের চতুরঙ্গ খেলা থেকে।
common_voice_bn_31653674.mp3,এরা প্রধানত ক্রান্তীয় বনুভূমিতে থাকতে বেশি পছন্দ করে।
common_voice_bn_31603646.mp3,তিনি বাংলাদেশ সরকারি কপরিকল্পনা মন্ত্রী হিসেবে কাজ করছেন।
common_voice_bn_31521055.mp3,আসাম সরকার এই অঞ্চলে সেচ বাঁধ নির্মাণ করে সাহায্য করেছেন।
common_voice_bn_31599648.mp3,"বেঙ্গবক্রত্বিপূর্ণ, হাস্যরসাত্মক বক্তৃতার জন্য রাজনৈতিক মহলে তার সুনাম ছিল।"
common_voice_bn_31584740.mp3,তার বাবার নাম আফসার উদ্দিন আহমেদ এবং মায়ের নাম সুফিয়া খাতুন।
common_voice_bn_31553713.mp3,সাধারণত এসব সুবিধা ভোগের জন্য নাগরিকের কর্মজীবন জুড়ে অর্থ প্রদানের প্রয়োজন পড়ে।
common_voice_bn_31593435.mp3,এর একক হার্জ।
common_voice_bn_31706573.mp3,আওয়ামী প্রতিনিধিরা এদিন প্রস্তাবিত শাসনতন্ত্রের খসড়া উপস্থাপন করেন।
common_voice_bn_31620001.mp3,তিনিই প্রথম দেশে প্রযুক্তিতে জন্য কলম তৈরির কারখানা করে ব্যবসা শুরু করেন।
common_voice_bn_31597269.mp3,স্কোয়াড হল দলের খেলোয়াড়দের তালিকা।
common_voice_bn_31627913.mp3,আর ঘড়ির কাটার বিপরীত দিকে ঘূর্ণনের ক্ষেত্রে বিচ্যুতি ঘটে ডানে।
common_voice_bn_31680667.mp3,অ্যারিজোনা এসে ক্রো স্কাউট নামে একটি স্কাউটিং কোম্পানি সহযোগিতার একটি ট্যালেন্ট শোতে অংশ নেন।
