path,sentence
common_voice_bn_31651171.mp3,"এর মধ্যে রয়েছে মধ্যে পাচ্ছে দক্ষিণ পর্ব সিরিয়ার কিছু অংশ, সহততরপূর্জর্দান, উত্তর সৌদি আরব, উপশ্চিম ইরাক।"
common_voice_bn_31634706.mp3,তাদের একটি ছেলে রয়েছে।
common_voice_bn_31539539.mp3,রিয়াদে অবস্থানকালে তিনি ভালো মতো আরবী ভাষাও আয়ত্ত করেন।
common_voice_bn_31524615.mp3,উচ্চতার শিক্ষয় তিনি কৃষিতে স্নাতক ডিগ্রি অর্জন করেন।
common_voice_bn_31572266.mp3,যেখান ব্যাংক ফোক স্টেশনের মৃত্যুর পর তিনি ফুল বা সেলার্স নাগালের শিষ্যত্ব গ্রহণ করেন।
common_voice_bn_31741856.mp3,শহরটি যোপুর জেলা ও যোধপুর বিভাগের প্রশাসনিক সদর দপ্তর হিসাবে কাজ করে।
common_voice_bn_31555666.mp3,লেফটেনেনজেনারেল পদবীতে তিনি তিতাস করেন অধিনায়ক হন।
common_voice_bn_31636707.mp3,কিন্তু অনেক দেরি হয়ে গেছে।
common_voice_bn_31678549.mp3,গাড়িতে তল্লাশি চালানোর পরে দুটি পুলিশ কুকুর গুরুতর অসুস্থ হয়ে পড়ে।
common_voice_bn_31644512.mp3,মেক্সিকান রোমান ক্যাথলিক পুরোহিত এবং মেক্সিকান স্বাধীনতা যুদ্ধের এক নেতা।
common_voice_bn_31628690.mp3,পূর্ব পাকিস্তান থেকে তখন প্রচুর শরণার্থী পশ্চিমবঙ্গে আশ্রয় নিয়েছিল।
common_voice_bn_31756191.mp3,ভ্যান কুবার প্রদেশের বৃহত্তম শহর অনেক পশ্চিমাভিত্তিক প্রাকৃতিক সম্পদ আহরণ সংস্থাগুলির সদর দপ্তর রয়েছে এখানে।
common_voice_bn_31675201.mp3,ক্রুশ আকৃতির বিভক্তি বা ভাগের কারণে এটি দেখতে তারকা সাদৃশ্য।
common_voice_bn_31635574.mp3,তার জীবনের প্রথম খ্যাতি আসে আকস্মিক ভাবে।
common_voice_bn_31606090.mp3,দুইটি ভিন্ন ভিন্ন উপায়ে মানব দেহে ভিটামিন এ তৈরি হতে পারে।
common_voice_bn_31576918.mp3,পাইথন একটু দেরিতে প্রজনন শুরু করে।
common_voice_bn_31662286.mp3,ছবিটিতে সাতটি গান রয়েছে।
common_voice_bn_31673554.mp3,তিনি ঘরোয়া প্রথমশ্রেণীর ক্রিকেটে ঢাকা বিভাগের প্রতিনিধিত্ব করেছেন।
common_voice_bn_31008288.mp3,"কারণ, তা সমীকরণের সর্বোচ্চ ঘাতের সহগ।"
common_voice_bn_31668117.mp3,প্রাকৃতিক পরিবেশের উপর স্থায়িত্ব এবং উচ্চ নির্বাচিলতল উপর দূর দে মসজিদটি রূপের প্রথম পরিবেশ অন্ধ মসজিদ।
common_voice_bn_31615764.mp3,তার টাকার অভাব থাকায় এবং ব্যবসা বাড়ানোর জন্য সে ধারে জিনিস বিক্রি করতো।
common_voice_bn_31673988.mp3,আগষ্ট তিনি বাদ পড়েন।
common_voice_bn_31630505.mp3,এর মধ্যে উচ্চাঙ্গ সঙ্গীত বিষয়টি বাধ্যতামূলক।
common_voice_bn_31528521.mp3,এটি স্নাতক এবং স্নাতক উত্তর ডিগ্রি প্রদান করে এবং এটি কলকাতা বিশ্ববিদ্যালয়ের অনুমোদিত কলেজ।
common_voice_bn_31669317.mp3,চলচ্চিত্রটি স্যান ড্যান্স চলচ্চিত্র উৎসবে প্রামাণ্যচিত্র বিভাগে স্যান্ডান্স গ্র্যান্ড জুরি পুরস্কার লাভ করেন।
common_voice_bn_31588725.mp3,এছাড়াও মাঝেমধ্যে উইকেটরক্ষকের ভূমিকায় অবতীর্ণ হতেন লউিনয়ার্ট হন।
common_voice_bn_31010243.mp3,অধিকাংশ সময়েই টম গডার্ডের সাথে বোলিং আক্রমণে নামতেন।
common_voice_bn_31617315.mp3,এই সময়ে পার্থে বৌদ্ধরা এবং সামান্য অর্থায়নে সন্নযাসীরা নিজেরাই অর্থ সঞ্চয়ের জন্য নির্মাণ শুরু করেছিলেন।
common_voice_bn_31569028.mp3,তখন কিন্তু এতরা সহজ ছিল না।
common_voice_bn_31546485.mp3,তার পিতা মোশাররফ হোসেন সরকারি কর্মচারী ছিলেন।
common_voice_bn_31548561.mp3,তাদের সংসারে এক পুত্র ও এক কন্যার জন্ম হয়েছিল।
common_voice_bn_31587865.mp3,বসন্ত কালের বৈষ্ণবদের একটি বিশেষ ধর্মীয় অনুষ্ঠান হলো দোল যাত্রা।
common_voice_bn_31537979.mp3,এর জেলা সদর দফতর তেনকাশীতে।
common_voice_bn_31509861.mp3,"যার মধ্যে রয়েছে নামাজ কক্ষ, বসার কক্ষ এবং অন্যন্য সুযোগ প্রদানকারী কক্ষ।"
common_voice_bn_31657113.mp3,বর্তমানে তিনি জাতীয় দল নির্বাচকের ভূমিকায় অবতীর্ণ হয়েছেন।
common_voice_bn_31576646.mp3,সাদা ও কিয় পৃষ্ঠের সাথে বাদামি বিন্দু থাকে।
common_voice_bn_31539007.mp3,বিদেশে ভ্রমণের ক্ষেত্রে পাস ফোটে মেয়াদ কমপক্ষে ছয়মাস থাকতে হবে।
common_voice_bn_31680529.mp3,ক্রু থেকে বা প্রতিটি আসনের ব্যক্তিগত স্পর্শ পর্দা থেকে তৈরি করা যেতে পারে।
common_voice_bn_31586640.mp3,উনবিংশ শতকের শেষদিকে পনেরো কাউন্টিতে এসে দাঁড়ায়।
common_voice_bn_31527431.mp3,ভারতে এই উৎসবে দেশবিদেশ থেকে বহু দর্শনার্থীদের আগমন ঘটে।
common_voice_bn_31738850.mp3,সেখানে তিনি আফগান সেনাবাহিনীর আধুনিকীকরণের জন্য কাজ করেন।
common_voice_bn_31628179.mp3,তিনি চুল রাজবংশের মূল শাখার বংশধর ছিলেন নাবরং ছিলেন পূর্ব চালুক্য রাজ বসের এক রাজকুমার।
common_voice_bn_31579659.mp3,অনেক কিছু ঘটেছে অনেক পরিবর্তন হচ্ছে।
common_voice_bn_31547997.mp3,এর নামকরণ করা হয়েছে উজির গোত্রের নাম অনুসারে।
common_voice_bn_31555554.mp3,বলের উপর বেশ নিয়ন্ত্রণ রেখে নির্দিষ্ট নিশানা বরাবর বোলিং কর্মে অগ্রসর হতেন।
common_voice_bn_31705469.mp3,গানের রেকর্ডিং করা হয়েছে শ্রুতি স্টুডিওতে।
common_voice_bn_31568635.mp3,ভাষা আন্দোলনে তিনি সক্রিয় ভূমিকা পালন করেন।
common_voice_bn_31662162.mp3,দুবে দিল্লি থেকে টেলিকম ইঞ্জিনিয়ারিং পড়ার জন্য মুম্বাই আসেন কিন্তু তারপর তিনি মডেলিং ক্যারিয়ার শুরু করেন।
common_voice_bn_31536629.mp3,এটি কলকাতা এর খুব কাছে।
common_voice_bn_31666486.mp3,তিনি বাংলাদেশের মুক্তিযুদ্ধে শহীদ হন।
common_voice_bn_31523848.mp3,আন্দোলন ব্যাপকতা লাভ করে আন্তর্জাতিক ক্ষেত্রে।
common_voice_bn_31521563.mp3,তিনি সার্কাস পরিবেশন করে অনেক দেশ ভ্রমণ করেছিলেন।
common_voice_bn_31612339.mp3,তবে আলেকপুর প্রাচীনাংশ নদীর বাম পাশে অবস্থিত।
common_voice_bn_31605491.mp3,এতে ভয় পেয়ে মিন সাপোর্ট পালিয়ে যান এবং বর্ধমানে আশ্রয় নেন।
common_voice_bn_31724371.mp3,আন্তর্জাতিক ক্রিকেটে ওয়েস্ট ইন্ডিজের প্রতিনিধিত্বকারী সেরা খেলোয়াড়দের অপূর্ব সমাবেশ ঘটে এখানে।
common_voice_bn_31594916.mp3,সকল চীনা সৈন্যকে ব্রিটিশ ফৌজে অন্তর্ভুক্ত করার সিদ্ধান্ত হয়।
common_voice_bn_31650591.mp3,কিন্তু ভৌগোলিক ও সাংস্কৃতিক বৈসম্মথাকায় তার বেশ কঠিন হয়ে দাঁড়ায়।
common_voice_bn_31568589.mp3,কংগ্রেস নেতা রাহুল গান্ধী এই বিষয়ে নরেন্দ্র মোদি সরকারের সমালোচনা করেছিলেন।
common_voice_bn_31537872.mp3,তৎকালীন রাষ্ট্রপতি জিয়াউর রহমান বিমানবন্দরটির সুভাউৎ্বাদন করেন।
common_voice_bn_31511257.mp3,বাইপোলার ডিজডারের ঘটনা পুরুষ এবং মহিলাদের পাশাপাশি বিভিন্ন সংস্কৃতি এবং জাতিগত গোষ্ঠীতে একই রকম।
common_voice_bn_31643348.mp3,তার পিতার নাম দার খানাত গঙ্গোপাধ্যায়।
common_voice_bn_31510610.mp3,উনিশ শতকে ব্রিটিশরা তাদের ওড়িশা থেকে নিয়ে এসেছিল সিলেট অঞ্চলে চা বাগানের শ্রমিক হিসাবে কাজ করণের জন্য।
common_voice_bn_31615398.mp3,তন্মধ্যে একবার গোল করতে সমর্থ হয়েছিলেন তিনি।
common_voice_bn_31511038.mp3,ইয়াঙ্গুন হল দেশের সর্বাধিক জাতিগতভাবে বৈচিত্র্যময় শহর।
common_voice_bn_31545039.mp3,কিন্তু তা হয়নি।
common_voice_bn_31003406.mp3,ওগ্লুউৎপাদার কারণে আকাশে ছাই ও বায়বীয় পদার্থের মত তৈরি হতে পারে।
common_voice_bn_31566061.mp3,মারাত্মক ধ্বংস হওয়া সত্ত্বেও ব্যক্তিগত জাহাজে আগত পর্যটকরা নেভির ভাবে এটি পরিদর্শন করেন।
common_voice_bn_31581550.mp3,"আর যে সমীকরণের সাহায্যে কোন রাশির মাত্রা প্রকাশ করা হয়ে থাকে, তাকে মাত্রা সমীকরণ বলে।"
common_voice_bn_31580102.mp3,তারা অন্যান্য মাছের প্রজাতির পাশাপাশি সমুদ্রের পাখি এবং সামুদ্রিক স্তন্যপায়ী প্রাণীর সাথে একই সাথে বসবাস করতে পারে।
common_voice_bn_31694181.mp3,এর ফলে একাধিক ছোট রাজ্য এই অঞ্চলে শাসনবার দখল করে।
common_voice_bn_31674996.mp3,এ ছবির পরিচালক তিনি নিজেই।
common_voice_bn_31520512.mp3,যান্ত্রিক বা আনুষ্ঠানিক যুক্তি অধ্যয়ন প্রাচীনকালে দার্শনিক ও গণিত বিদ্যের সাথে শুরু হয়েছিল।
common_voice_bn_31572704.mp3,তিনি বেশ কিছু টেলিভিশন ধারাবাহিকে হাজির হয়েছেন।
common_voice_bn_31606671.mp3,"তিনি একজন ইসলামী আইনবিদ, লেখক এবং ভারতের প্রাক্তন প্রধান মুফতি ছিলেন।"
common_voice_bn_31631415.mp3,তিনি বিদ্যালয়ে পড়াকালীন তার প্রথম প্রামাণ্যচিত্র নাটক পূর্ব লন্ডন তৈরি করেছিলেন।
common_voice_bn_31561808.mp3,কলেজে অর্থ সরবরাহ প্রায় যথেষ্ট হত না।
common_voice_bn_31748285.mp3,প্রায় সমগ্র এলাকাই পুরু কাদা দিয়ে আবৃত।
common_voice_bn_31554357.mp3,চ্যানেলটির ওয়েবসাইটে অনুষ্ঠান সরাসরি সম্প্রচারের একটি লাইভ স্ট্রিম রয়েছে।
common_voice_bn_31661866.mp3,বিশেষ করে মার্কিন যুক্তরাষ্ট্র ও কানাডাতে ধূমপানবিরোধী কঠোর মনোভাবের বহীর প্রকাশ ঘটে।
common_voice_bn_31555377.mp3,জাহাজটি মার্কিন যুক্তরাষ্ট্রে নিবন্ধিত।
common_voice_bn_31596743.mp3,"আমরা যদি অঞ্চলে সমৃদ্ধ হতে চাই, তবে আমাদের অবশ্যই উৎসাহিত উদ্যোগের মাধ্যমে তরুণদের মধ্যে বিনিয়োগ করতে হবে।"
common_voice_bn_31522567.mp3,এটিকে অতীতে আর্মি হাউজিং স্কিম নামে উল্লেখ করা হয়েছিল।
common_voice_bn_31557703.mp3,গল্পের চূড়ান্ত সমাপ্তি ঘটে বাচ্চা ছেলেটির ঘুম থেকে উঠার মধ্যে দিয়ে।
common_voice_bn_31539202.mp3,তার চলচ্চিত্রগুলিতে প্রধানত নারী এবং নারীর অধিকার সম্পর্কিত বিষয়ে জোর দেওয়া হয়ে থাকে।
common_voice_bn_31511784.mp3,তরুণ বয়সে দেশের রাজনীতির জন্য ঝুঁকিপূর্ণ কাজ করেছিলেন।
common_voice_bn_31619922.mp3,তার জন্মস্থান ছোট কাটরা মহল্লার নিকটস্থ হাকিম হাবিবুর রহমান লেন তার স্মরণে নামকরণ করা হয়েছে।
common_voice_bn_31692571.mp3,ব্যবহার করা হলে প্রতীকটি নামের আগে থাকা উচিত।
common_voice_bn_31513576.mp3,এ পর্বতমালা অসংখ্য জীবন তক নিয়োগের ধারণ করে আছে।
common_voice_bn_31679980.mp3,এখানে শুধুমাত্র নিজের গবেষণা কর্ম লিখিত আকারে জমা দেয়া যাবে।
common_voice_bn_31606709.mp3,আরাধনা ছায়াছবিটির সঙ্গীত পরিচালনা করেছেন আলম খান।
common_voice_bn_31514311.mp3,বিদ্যালয়ে চারটি হাউস রয়েছে।
common_voice_bn_31665208.mp3,ইমন সাহা একটি গানের সুর ও সঙ্গীত প্রযোজনা করেছেন।
common_voice_bn_31566953.mp3,এছাড়াও সুদক্ষ ফিল্ডার হিসেবেও সুনাম ছিল তার।
common_voice_bn_31571767.mp3,একটি সংকোচন ও একটি প্রসারণ নিয়ে এর তরঙ্গ দৈর্ঘ্য।
common_voice_bn_31509994.mp3,টুর্নামেন্টের টাইটেল স্পন্সর ছিল ওয়ালটন।
common_voice_bn_31638327.mp3,অপর দিকে আর অঙ্গ জের ছিলেন একজন কট্টর মুসলিম।
common_voice_bn_31568539.mp3,কিছুদিন আনন্দ মোহন কলেজের অধ্যাপক ছিলেন।
common_voice_bn_31635129.mp3,এগুলি মূলত সামন্ত কাউন্টির উপর ভিত্তি করেছিল।
common_voice_bn_31572313.mp3,দিন দিন বিশ্ব তাপমাত্রা বাড়ছে।
common_voice_bn_31618472.mp3,এটি স্ক্যান্ডিনেভিয়ার বৃহত্তম ক্রিয়া বিভাগ।
common_voice_bn_31661818.mp3,এগুলি পবিত্র ভবনের একটি বিশেষ রূপ কোনটি পৃথক প্রতিষ্ঠান বা কোনটি বৃহৎ মসজিদের সাথে সংযুক্ত?
common_voice_bn_31519406.mp3,তিনি রাজ্যে শিক্ষার প্রসার ঘটান ও সেচ খাল নির্মাণ করেন।
common_voice_bn_31719033.mp3,তিনি দশদিন আন্তর্জাতিক মহাকাশ স্টেশনে পাঠ করেন।
common_voice_bn_31596225.mp3,ফুলের সুবাস একটি মিষ্টি মধুর মত হয়ে থাকে।
common_voice_bn_31556012.mp3,অর্থাৎ পদার্থের দশা তাপমাত্রা ও চাপের উপর দিয়ে বর্ষের।
common_voice_bn_31629605.mp3,"পশ্চিমা বংশোদ্ভূত তিনি প্রথম ব্যক্তি, যিনি নিজে পীর হিসেবে জীবন যাপন করেন।"
common_voice_bn_31698277.mp3,দুর্গাপুর হর সড়ক ও রেলপথ দ্বারা ভারত বছরের বাকি অংশ ও শহরগুলোর সংলভালভাবে যুক্ত রয়েছে।
common_voice_bn_31554928.mp3,এর কারণ মূলত ঐতিহাসিক অস্থিরতাজনিত।
common_voice_bn_31619100.mp3,"আব্বাস উদ্দিন ছিলেন প্রথম মুসলমান গায়ক, যিনি আসল নাম ব্যবহার করে এইচ এম ভি থেকে গানের রেকর্ড বের করতেন।"
common_voice_bn_31605887.mp3,এই চলচ্চিত্রের মাধ্যমে তিনি নেতিবাচক চরিত্রে অভিষেক করেন।
common_voice_bn_30998341.mp3,এই সময়ে তিনি বাচ্চাদের পক্ষে কাজ করেছিলেন এবং বই এবং ক্যাসেট প্রকাশ করেছিলেন।
common_voice_bn_31745805.mp3,"এটি একটি বড়সড় আকারের কালো রোগের পাখি, যা প্রাচীন মেরিকা ও উত্তর আমেরিকার আটলান্টিক উপকূলের বেশিরভাগ অঞ্চলে প্রজনন সম্পন্ন করে।"
common_voice_bn_31622615.mp3,এর অধিকাংশই প্রি সরকার লাইসেন্সের অধীনে প্রকাশিত।
common_voice_bn_31604449.mp3,মিশ্র প্রথম জীবনে শিক্ষকতা করতেন।
common_voice_bn_31542125.mp3,তিনি উত্তরপূর্ব ভারতের মণিপুর রাজ্যের অধিবাসী।
common_voice_bn_31607352.mp3,যুদ্ধের প্রথম সপ্তাহেই মিত্রবাহিনী জার্মানির সকল উপনিবেশে সামরিক অভিযান চালায়।
common_voice_bn_31601182.mp3,তিনি বাম রাজনীতি ও নকশাল আন্দোলনের সাথে যুক্ত ছিলেন।
common_voice_bn_31786508.mp3,দুটি ইংরেজিতে লেখা।
common_voice_bn_31650895.mp3,অবশ্য অব তের তেরো বছর নিজ দেশের পক্ষে খেলার খেলার সুযোগ তিনি।
common_voice_bn_31557584.mp3,কলকাতার প্রেসিডেন্সি কলেজ হইতে উচ্চ শিক্ষা গ্রহণ করে আইন অধ্যয়নের জন্য তিনি লন্ডনে গমন করেনতিনি আসামের তৃতীয় বিচারক ছিলেন।
common_voice_bn_31544411.mp3,তার পিতার নাম পাহিম উদ্দিন বিশ্বাস ও মাতার নাম আনোয়ারা খাতুন।
common_voice_bn_31731017.mp3,"দুই সরকারে তিনি সরাষ্ট্র, স্বাস্থ্য, যুব ও ক্রীড়া, বেসরকারী বিমান ও পর্যটন মন্ত্রণালয়ের দায়িত্ব পালন করেন।"
common_voice_bn_31544085.mp3,বাহরাইনী চলচ্চিত্র নির্মাতা সালেহ নাস দ্বারা পরিচালিত একটি চলচ্চিত্রে তাকে দেখা গিয়েছিল।
common_voice_bn_31606184.mp3,অষ্টম সংসদে তিনি সয়ষ্টমন্ত্রণালয়ের প্রতিমন্ত্রী হিসেবে দায়িত্ব পালন করেন।
common_voice_bn_31643413.mp3,ভালো আক্রমণের কাজে এ তথ্য সহায়তা করে।
common_voice_bn_31576969.mp3,কখনো কখনো এ সঙ্গী জন পদার্থ এবং পানির অণু উভয়কেই দুটি ভাগে বিভক্ত করে।
common_voice_bn_31711920.mp3,"পরবর্তী প্রজন্মের নিকট, যা ছিল রানীর নিকট থেকে প্রাপ্ত সর্বোচ্চ সম্মানের চিহ্ন সরূপ।"
common_voice_bn_31524562.mp3,বর্তমানে তিনি ইসলামী বিশ্ববিদ্যালয়ের উপাচার্য হিসেবে দায়িত্ব পালন করছেন।
common_voice_bn_31634940.mp3,তাই এটি নিয়ে অনেকে নেতিবাচক কথা বলবে।
common_voice_bn_31537597.mp3,ব্যাংকের সংখ্যা কমানোর প্রয়োজনীয়তার ফলস্বরূপ ব্যাংকটি গঠিত হয়েছিল।
common_voice_bn_31675220.mp3,এছাড়াও নিউজিল্যান্ড এ ক্রিকেট দলের হয়ে খেলছেন তিনি।
common_voice_bn_31558734.mp3,এটি গোবিন্দগঞ্জ উপজেলার অন্যতম একটি ইউনিয়ন।
common_voice_bn_31645863.mp3,উচ্চ মানের মাংস ও চামড়ার জন্য এই জাত প্রসিদ্ধ।
