path,sentence
common_voice_bn_31744060.mp3,বিশেষ করে পর্যাপ্ত শীতল সংরক্ষণাগার গুণগত ও পরিমাণগত দৃষ্টি গণ থেকে খাদ্যের অপচয় রোধে অতিআবশ্যকীয় ভূমিকা পালন করে।
common_voice_bn_31544014.mp3,এই বংশের সবচেয়ে কৃতী সন্তান হলেন চার্লস ডারউইন।
common_voice_bn_31542984.mp3,পরবর্তী দশ বছরে অনেকগুলো প্রতিযোগিতার শিরোপা পান।
common_voice_bn_31538095.mp3,"এই কাঠের সাহায্যে আমরা ঘর, আসবাবপত্র, নৌকা, লঞ্চ, জাহাজ ইত্যাদি তৈরি করি।"
common_voice_bn_31673223.mp3,"যাইহোক, পুরুষরা যখন এই সিরিজে অবস্থিত হন, তারা আসলে পুরুষের তত্ব বাসা মহিলা।"
common_voice_bn_31569168.mp3,রেলপথটি এই অংশে একটি খাল অতিক্রম করে।
common_voice_bn_31564380.mp3,সাধারণত এক সপ্তাহের বিরোধিতে কমপক্ষে তিনবার মা পালা নিয়ে।
common_voice_bn_31519113.mp3,"যেমন হীরা, সোনা, সালফার তামা প্রভৃতি।"
common_voice_bn_31619945.mp3,কৃষক লীগের প্রতিষ্ঠাতা সভাপতি তিনি।
common_voice_bn_31576627.mp3,তিনি একটি আন্তর্জাতিক চ্যারিটি প্রতিষ্ঠান গঠন করেন।
common_voice_bn_31542707.mp3,এই পত্রিকার প্রতিষ্ঠাতা খ্যাতনামা সাহিত্যিক দীনেশচন্দ্র চট্টোপাধ্যায়।
common_voice_bn_31678026.mp3,সিদ্ধান্ত অনুমান করে যে ক্রয়ের সিদ্ধান্তগুলি ঘটে না।
common_voice_bn_31536542.mp3,সব দেশে প্রচলিত আইনে জোরূর্ব প্রতিটা ভিত্তি অবৈধ।
common_voice_bn_31712225.mp3,এতে অদ্বৈতাচার্যের বাল্যলীলার বিবরণ আছে।
common_voice_bn_31643719.mp3,বাংলাদেশে কালো ভাল্লুক মহাবিপন্ন প্রজাতি হিসেবে বিবেচিত হলেও সম্ভবত বাংলাদেশ থেকে বিলুপ্ত হয়ে গেছে।
common_voice_bn_31632597.mp3,"তাদের মতে, কৃষ্ণের অনুগামীদের বলা হতো ভাগবত।"
common_voice_bn_31742695.mp3,তারপরে তিনি মালায়ালাম সাময়িকীতে সাহিত্যভিত্তিক চিত্রের চর্চায় একটি গবেষণা থিসিস তৈরি করেছিলেন।
common_voice_bn_31512237.mp3,পরবর্তীতে তিনি ভক্তদের সমালোচনার মুখে পড়ে এ মন্তব্যের জন্য ক্ষমা চান।
common_voice_bn_31542810.mp3,বর্তমানে এই নদী উত্তর চব্বিশ পরগনা ও কলকাতার অন্যতম প্রধান নিকাশি মাধ্যম।
common_voice_bn_31569910.mp3,ডানহাতে ব্যাটিংয়ের পাশাপাশি ডানহাতি অফব্রেক বোলিং করে থাকেন পল স্টার্লিং।
common_voice_bn_31653611.mp3,ডাক্তার বাড়ি চলচ্চিত্রের সঙ্গীত পরিচালনা করেছেন ইমন সাহা।
common_voice_bn_31513921.mp3,এই তহবিল সমগ্র দেশে ওয়ান স্টপ সেন্টার বা সখী সৃষ্টি করার জন্য ব্যবহার করা হয়েছিল।
common_voice_bn_31582439.mp3,ক্রিকেটের পাশাপাশি শৌখিন ফুটবলার হিসেবেও যথেষ্ট সফলতার স্বাক্ষর রেখেছেন।
common_voice_bn_31651918.mp3,এছাড়াও কোম্পানিটি পরবর্তীতে আর বিভিন্ন অর্থ বিনয়োগকারী সংস্থা হতে অর্থ সাহায্য নেয়।
common_voice_bn_31603083.mp3,দল ত্যাগ করে প্রথমে ডার্বিশায়ার ও পরবর্তীতে ইয়র্কশায়ারে যোগ দেন।
common_voice_bn_31520887.mp3,তিনি কমেডি সিনেমা দ্য হট চিক হলিউড চলচ্চিত্রের মাধ্যমে আত্মপ্রকাশ করেন।
common_voice_bn_31587005.mp3,"এটি ছিল একটি প্রিমিয়াম পশ্রনী, যা দর্শকদের একটি নির্দিষ্ট পরিমাণ অর্থ খরচ করার মাধ্যমে দেখতে হত।"
common_voice_bn_31672060.mp3,এতে বলরাম খুব ত হন।
common_voice_bn_31534966.mp3,তাদের মধ্যে ছয়জন পরে মারা যান।
common_voice_bn_31628801.mp3,জুলফিকার আলী ভুক্ত ছাড়া অন্যান্য পশ্চিম পাকিস্তানি চিবিন্দ প্রস্তাবকে স্বাগত জানান।
common_voice_bn_31702321.mp3,তবে তিনি মাত্র দুই টেস্টে অংশগ্রহণের সুযোগ লাভ করেছিলেন।
common_voice_bn_31522920.mp3,এখানে হলিডে ইন হোটেল রয়েছে।
common_voice_bn_31619878.mp3,তিনি বহুসংখ্যক সাম্মানিক উপাধি লাভ করেন।
common_voice_bn_31640226.mp3,ক্যাম্প সাই অর্থ হল ক্যাম্প তার।
common_voice_bn_31559855.mp3,যে বিমানগুলি অধিষ্ঠিত বার্মায় জাপানি বাহিনীর উপর গোয়েন্দা তথ্য সংগ্রহের জন্য বেশ কয়েকটি ম্যাপিং ক্যামেরায় সজ্জিত ছিল।
common_voice_bn_31571559.mp3,তিনি নিজেও শতাধিক শিখ ধর্মপ্রচার কেন্দ্র স্থাপন করে শিখধর্মের বৃত্তি সুধীর করেন।
common_voice_bn_31517717.mp3,বর্তমানে মাইক্রোনেশিয়া যুক্তরাজ্য ফুটবল এসোসিয়েশনের সভাপতির দায়িত্ব পালন করছেন জেফ্রি উইদাল।
common_voice_bn_31527886.mp3,একই দিনে তাঁর শেষকৃত্য হয়েছিল।
common_voice_bn_31600125.mp3,এই মন্দিরে রামেশ্বর স্তম্ভ অবস্থিত।
common_voice_bn_31655375.mp3,আনুমানিক এই জিনের সংখ্যার কিছুটা কম বেশি হতে পারে।
common_voice_bn_31538551.mp3,রবার্টের ক্লাবে যোগদান ছিল ক্লাবের উন্নয়নের জন্য খুবই গুরুত্বপূর্ণ।
common_voice_bn_30999701.mp3,"তার গবেষণার মূল বিষয় ডেটা সাইন্স, মেশিন লার্নিং, বায়োইনফর্মেটিক্স এবং ইন্টারনেট অফ থিংস।"
common_voice_bn_31550900.mp3,মূল বামিয়ান উপত্যকাটি এই উচু প্রায় উচ্চভূমির উত্তরদিকে মুখ করে অবস্থিত।
common_voice_bn_31527787.mp3,অবূধপূর্বমেক্রু চক্রীয় প্রণালী আবিষ্কারের জন্য তিনি পরিচিত।
common_voice_bn_31678951.mp3,পেশাগত জীবনে তিনি ছিলেন একজন ডাটা ও রাজনীতিবিদ।
common_voice_bn_31588778.mp3,হেডকোয়ার্টার কোম্পানির একটি প্লাটুনের দায়িত্বে ছিলেন তিনি।
common_voice_bn_31615202.mp3,"যেসব চতুষ্পদ প্রাণী প্রথম জল ছেড়ে ডাঙায় উঠে আসে, তাদের মধ্যে এরা ছিল অন্যতম।"
common_voice_bn_31527858.mp3,একে প্রাথমিকভাবে স্কুল অফ ইনফ্যান্টি বলা হত।
common_voice_bn_31613576.mp3,নিজ প্রদেশের পক্ষে তিনি বেশ সফল হয়েছিলেন।
common_voice_bn_31538486.mp3,শ্রীলঙ্কা জাতীয় ক্রিকেট দলে স্পিন বোলিংয়ের কোচের দায়িত্ব পালন করেন।
common_voice_bn_31560263.mp3,নিম্ন তাপমাত্রায় ব্যাক্টেরিয়া কম প্রযোজন করে ও কম ছড়ায় সে কারণে খাদ্য সহজ পচে না।
common_voice_bn_31635502.mp3,"অধিকরণের কাঠামো ছিল, যতবা কর্পোরেট ধরনের।"
common_voice_bn_31563915.mp3,"যদি অতিরিক্ত সময়ের পরেও খেলার ফলাফল সরলতা থাকে, তবে খেলার ফলাফল পেনালটি সুটাউটের মাধ্যমে নির্ধারণ করা হয়েছিল।"
common_voice_bn_31634883.mp3,তেমন ভাবে ওকে বলা হলে ও নিশ্চয়ই আমন্ত্রিত হত।
common_voice_bn_31673330.mp3,উইকেটরক্ষক ও নিচেরসারির ব্যাটসম্যান হিসেবে নর্ডব্যান্ড স্ট্রোকের পক্ষে খেলোয়াড়ী জীবনের সূত্রপাত ঘটে তার।
common_voice_bn_31566374.mp3,চমৎকারভাবে ফাস্ট মিডিয়াম বোলিং করতেন।
common_voice_bn_31614109.mp3,"পুলিশ থেকে নিজেকে বাঁচাতে না পেরে রঘু তার বাড়িতে ফিরে এসে মাকে বলে, তাকে বাঁচাতে।"
common_voice_bn_31006425.mp3,এছাড়া এখানে পড়াশুনার পাশাপাশি মেধাবী শিক্ষার্থীদের জন্য রয়েছে বৃত্তির ব্যবস্থা।
common_voice_bn_31711132.mp3,দৃষ্টিনন্দন প্রধান গম্বুজ এ মসজিদের খুবই উল্লেখযোগ্য বৈশিষ্ট্য এবং তা অষ্টভুজাকৃতির ড্রামের উপর স্থাপিত।
common_voice_bn_31524138.mp3,তার নানী ছিলেন একজন ্ধরুষ এবং অর্ধ ইউক্রেনীয়।
common_voice_bn_31744567.mp3,তিনি সমিতির সদস্যদের জন্যও মিছিলের পরিকল্পনা করেন।
common_voice_bn_31578526.mp3,সাদা চা মূলত নামেই সাদা।
common_voice_bn_31559591.mp3,প্রতিফলন দূরবীক্ষণ যন্ত্র উদ্ভাবন করেন জেমস গ্রেগরি।
common_voice_bn_31636429.mp3,চলচ্চিত্রের সাধারণ প্রাণীর পরিব্যক্তি এর কিছু উদাহরণ।
common_voice_bn_31514697.mp3,দক্ষিণাংশ রেলওয়ে স্টেশনের রেলপথে বইগাটিক ট্রেন চলাচল করে।
common_voice_bn_31565611.mp3,এটি আয়তনের দিক থেকে ব্রাহ্মণবাড়িয়া জেলার সবচেয়ে ছোট ইউনিয়ন।
common_voice_bn_31601359.mp3,এটি ক্ষমতা বৃদ্ধি করে যদিও এটি সাময়িক হতে পারে।
common_voice_bn_31536191.mp3,এ প্রজাতির সাপ পৃথিবীতে ব্যাপক বিস্তৃত।
common_voice_bn_31528090.mp3,যা আমাদের কঠিন বাস্তবতাকে আবারও সামনে নিয়ে আসে।
common_voice_bn_31681388.mp3,আল শাফি এর মতো তিনি জনসাধারণকে এটি অধ্যয়ন থেকে নিরুৎসাহিত করেছিলেন।
common_voice_bn_31602840.mp3,তিনি শৈশবে বেড়ে উঠেছেন লসেঞ্জেলসে।
common_voice_bn_31604970.mp3,পূর্বে চে বর্তমানে এই সেকেন্ড মানক সেকেন্ড অপেক্ষা আরও দীর্ঘতর হয়েছে।
common_voice_bn_31533185.mp3,তাই সেবার তিনি ফিরে যান।
common_voice_bn_31517234.mp3,মেয়র সিটি কর্পোরেশনের কার্যনির্বাহী প্রধান হিসেবে কাজ করেন।
common_voice_bn_31529298.mp3,এরপর তিনি আলজামিয়া আল ইসলামিয়া পটিয়া এবং দারুল মাঠ হাজারী থেকে মাধ্ভামমে শিক্ষা অর্জন করেন।
common_voice_bn_31657974.mp3,পুলিশ কর্তৃপক্ষ ঘটনার তদন্তে আসে।
common_voice_bn_31575810.mp3,দক্ষিণ কোরিয়ায় বহু সংখ্যক দ্বীপ রয়েছে।
common_voice_bn_31518522.mp3,"খোয়াই নদী, ভারতের ত্রিপুরা ও বাংলাদেশের সিলেট বিভাগের মধ্য দিয়ে প্রবাহিত একটি নদী।"
common_voice_bn_31752403.mp3,কখনো মূর্তির কোলে কৃষ্ণ বা রাধাকৃষ্ণের যুগল মূর্তি থাকে।
common_voice_bn_31625192.mp3,তবে এদের সব সস নির্দিষ্ট করতে হবে।
common_voice_bn_31021275.mp3,চলচ্চিত্রটি লিখেছেন এবং পরিচালনা করেছেন ভাস্কর।
common_voice_bn_31536126.mp3,কংগ্রেসের সংকর দাস এবং আদ্বুল সাত্তার উভয়ই জয়ী হন।
common_voice_bn_31711834.mp3,যুদ্ধে বিদ্রোহীরা পরাজিত।
common_voice_bn_31522321.mp3,ফলে ব্যাটসম্যানের তার নিচু হয়ে আসা বলগুলো থেকে এড়িয়ে দীর্ঘক্ষণ ক্রিজে অবস্থানের সুযোগ পেয়েছেন।
common_voice_bn_31646959.mp3,তিনি ভারতের প্লাজমা পদার্থবিজ্ঞান সমিতি এবং ভারতের আলোকবিজ্ঞান সমিতির সভাপতি হিসেবেও দায়িত্ব পালন করেছেন।
common_voice_bn_31519876.mp3,এই অসুর সাধারণত এক ঘণ্টার মধ্যে কাজ করা শুরু করে।
common_voice_bn_31549135.mp3,হিজবুল্লাহ অপহত সৈন্যদের মুক্তির বিনিময়ে ইসরায়েলের দ্বারা আটক করে রাখা লেবানিজ বন্দীদের মুক্তি দাবি করে।
common_voice_bn_31531893.mp3,এ সময়ে অটোমান সম্রাজ্যের গণহত্যা থেকে বেচে যাওয়া হাজারহাজার আর্মেনিয়ান শহরটিতে বসবাস শুরু করে।
common_voice_bn_31651408.mp3,"তন্মধ্যে বেশ কিছু মুক্তা অত্যন্ত দুর্লভ, চমৎকার, প্রশংসনীয় এবং প্রতি বমি বা নেমে থাকেন।"
common_voice_bn_31531965.mp3,আঙুল দেখে তার বোন তার মৃতদেহ সনাক্ত করে।
common_voice_bn_31513941.mp3,যা স্টিলের তৈরী বলে লেখক দাবী করেন।
common_voice_bn_31634749.mp3,তাছাড়া তিনি মার্কিন যুক্তরাষ্ট্রের অষ্টম উপরাষ্ট্রপতি ছিলেন।
common_voice_bn_31585781.mp3,এর উদাহরণ হলো শদ্ব তরঙ্গ।
common_voice_bn_31562798.mp3,ব্যবসায়িক কাজ ছাড়াও শিক্ষা ও দাপ্তরিক ষাজেও এর ব্যবহারের গুরুত্ব রয়েছে।
common_voice_bn_31499753.mp3,নরম্যান্ডি আক্রমনের শুরুর কথা।
common_voice_bn_31554183.mp3,আন্তর্জাতিক ক্রিকেট থেকে প্রত্যাখ্যাত হবার পরও কাউন্টি ক্রিকেটে খেলা চালিয়ে যান।
common_voice_bn_31551407.mp3,"বাংলাদেশের উত্তরাংশে ভারতের ইশা বিহার, জারকণ্ড, মধ্য প্রদেশ ছত্রীরঘর, পশ্চিমবঙ্গে নেপাল এবং গঠনে এই পাশাপাশি জনগোষ্ঠী আছে।"
common_voice_bn_31733980.mp3,বর্তমানে তিনি সরকারের ভারপ্রাপ্ত প্রধানমন্ত্রীর কার্যাবলী পালন করে যাচ্ছেন।
common_voice_bn_31611286.mp3,এটি রংপুর শহরের ধাপ এলাকার জেল রোডে জেলা কারাগারের বিপরীতে অবস্থিত।
common_voice_bn_31596179.mp3,জন্মের পরেই তার বাবা মারা যান।
common_voice_bn_31678374.mp3,কিন্তু তারা মুক্তিযোদ্ধাদের হাতে চরমভাবে মার খায়।
common_voice_bn_31542169.mp3,সবচেয়ে অবহেলিত একটি এলাকা।
common_voice_bn_31613950.mp3,খুব সম্ভবত এটি সুমীর্ঘ শাসনাধীন প্রশাসনিক কেন্দ্রগুলির মধ্যে একটি ছিল।
common_voice_bn_31521809.mp3,তিনি তার বাবা মায়ের তিন সন্তানের মধ্যে জ্যেষ্ঠ ছিলেন।
common_voice_bn_31565962.mp3,জনসাধারণ শাসক রাজ্কুমারি কাছে অভিষেক জানান।
common_voice_bn_30994438.mp3,"বিবেকানন্দের পুর শৈশব, প্রথম জীবন এই বাড়িতেই কাটে।"
common_voice_bn_31798416.mp3,আগুন লাগার কারণ এখনও তদন্ত করছে কর্তৃপক্ষ।
common_voice_bn_31592461.mp3,মহারাষ্ট্র এবং পুথি রাত সমেত ভারতের অন্যান্য অংশেও একই নামে এই নৃত্য পশ্রিত হয়ে থাকে।
common_voice_bn_31766572.mp3,"জি ভাষা বা ভাষা পরিবার বিশ্বে ব্যাপক অঞ্চল জুড়ে ছড়িয়ে আছে, সেগুলোতে এই ব্যাপারটি খুবই সাধারণ।"
common_voice_bn_31554154.mp3,তাদের নেতৃত্বে বাণিজ্যিক সম্প্রচারে যাবতীয় কার্যক্রম চূড়ান্ত করে নাগর এক টিভি।
common_voice_bn_31559206.mp3,চলচ্চিত্রটি শ্রেষ্ঠ চলচ্চিত্রের জন্য মেরিল প্রথম আলো সমালোচক পুরস্কার লাভ করে।
common_voice_bn_31643555.mp3,দুই দশক আগে এই বনে কয়েক হাজার উল্লোখ দেখা যেত।
common_voice_bn_31649889.mp3,অপ্রয়োজনীয় ও অতিরিক্ত শদ্বের কারণে ব্যক্তির শারীরিক ও মানসিক স্বাভাবিক কার্যকলাপ ভীষণভাবে ক্ষতিগ্রস্ত হতে পারে।
common_voice_bn_31517838.mp3,তখন তাদের একই সঙ্গে সামরিক ক্ষমতাও ছিল।
common_voice_bn_31674043.mp3,এই আন্দোলনে তিনি তিন বার গ্রেফতার হন।
common_voice_bn_31654104.mp3,এই সংস্থার সদর দপ্তর কেনিয়ার রাজধানী নাইরোবিতে অবস্থিত।
common_voice_bn_31615585.mp3,রোমান লেখক প্লিনি দা অ্যান্ডার রচিত একটি নাটকেও এর উল্লেখ রয়েছে।
common_voice_bn_31584342.mp3,তার পিতা মুন্সী জানে আলম হাওলাদার ইউনিয়ন বোর্ডের চেয়ারম্যান ও তৎকালীন ব্রিটিশ সরকারের জেলা জুরির বোর্ডের সদস্য ছিলেন।
common_voice_bn_31648678.mp3,মহারাষ্ট্রের পক্ষে প্রথমশ্রেণীর ক্রিকেটে নিয়মিতভাবে বোলিং দা উদ্বোধনে নামতেন।
common_voice_bn_31509739.mp3,সাধারণ ব্রাহ্মণ সমাজ কর্তৃক প্রকাশিত আধ্যালিক সঙ্গীত সংগ্রহ।
common_voice_bn_31572578.mp3,এছাড়া তিনি টেলিভিশনের জন্য বাণিজ্যিক চলচ্চিত্রও নির্মাণ করেছেন।
common_voice_bn_31511393.mp3,"স্বাধীনতা ও দেশপ্রেম নিয়ে অসংখ্য কালজয়ী গানের স্রষ্টা মাঝারুলানোয়ার একাধারে একজন চলচ্চিত্র পরিচালক, প্রযোজক, রচয়িতা, গীতিকার ও সুরকার।"
common_voice_bn_31536127.mp3,ভরসা করার মতো কাউকেই সে পায়নি।
common_voice_bn_31534151.mp3,পরবর্তীকালে গানটিতে সুরারোপ করেছিলেন আলতাফ মাহমুদ।
common_voice_bn_31566785.mp3,তিনি বৈদ্য জমিদার পরিবারে জন্মগ্রহণ করেন।
common_voice_bn_31793578.mp3,অতঃপর তিনি মৃত্যুবরণ করেন।
common_voice_bn_31553679.mp3,মুখের সুস্থতা অধিকাংশ এ মুখ পরিষ্কার রাখা সংক্রান্ত নিয়মিত চর্চার উপর নির্ভর করে।
common_voice_bn_31555552.mp3,জার্মান ভাষার উপভাষাগুলি সুইজারল্যান্ডের উত্তরাংশ থেকে শুরু হয়ে অবিচ্ছিন্নভাবে উত্তর দিকে অগ্রসর হয়ে উত্তর সাগর পর্যন্ত চলে গেছে।
common_voice_bn_31565777.mp3,তিনি উদ্বাস্তুদের পুনর্বাসনের দাবিতে সরকারের উপর চাপ সৃষ্টি করেন।
common_voice_bn_31522422.mp3,এটি সকল শিক্ষার্থীদের মাঝে অসাম্প্রদায়িক চেতনাকে উদ্বুদ্ধ করবে।
